vraag,antwoord
Welke stad in het noordwesten van het Europese deel van Turkije was hoofdstad der Ottomanen voor ze Constantinopel innamen?, Adrianopel of Edirne
Welke staat heeft een beer in zijn vlag?, California
Hoe heet de regio waar Mohammed opgroeide en de steden Mekka Medina en Jeddah liggen, Hidjaz
Welk omstreden woestijngebied vormt de driehoek die Ethiopië uitsnijdt Somalië?, Ogaden
Eindpunt van de zijderoute en hoofdstad van China tijdens de Tangdynastie, Xian
Hoe heet de vallei in Libanon tussen het Libanon en het anti-Libanongebergte?, Beka
Wat is de langste rivier van Libanon?, Litani
Welke belangrijke rivier uit de oudheid loopt vanuit Libanon via Syrië naar Turkije en mondt uit nabij het oude Antiochië?, Orontes
Welke zeestraat verbindt de Zee van Azov met de Zwarte Zee?, Straat van Kertsj
welke zeestraat verbindt de Egeïsche Zee met de Zee van Marmara?,Karische Poort
Welk stadje in Zuid-Afrika is een soort van reservaat of vrijstaat waar enkel blanken zonder strafblad toegelaten zijn die Afrikaans spreken?, Orania
Hoe heet het grootste meer van Zuid-Afrika naar de dochter van de stichter van de transvaalrepubliek?, Chrissie
X Retief en Gerrit Y waren twee voortrekkers waarvan het ontbrekende deel van hun naam werd gecombineerd tot de naam van een stad in Zuid-Afrika, Pietermaritzburg
Welke zee ligt tussen India Myanmar en Thailand en maakt deel uit van de Indische Oceaan?,Andamanse Zee
Welke smalle landstrook tussen Polen en Litouwen vormt een strategische NAVO-doorgang?,Suwałki-corridor
Welke historische stad met een acropolis ligt op het Griekse eiland Rhodos?,Lindos
Welke Spaanse havenstad ligt in de regio Murcia en heeft een belangrijke marinebasis?,Cartagena
Welke steen in Ierland zou volgens de legende welsprekendheid schenken wanneer je hem kust?,Blarney Stone
Welk Iraans eiland in de Perzische Golf is bekend om zijn olie-industrie?,Kharg
Welke Boliviaanse stad was tijdens de koloniale periode beroemd om haar zilvermijnen?,Potosí
Hoe heette de hoofdstad van Nederlands-Indië op Java?,Batavia
Welke eilandstaat ligt nabij de evenaar en omvat gebieden rond Baker Island?,Kiribati
Welke Ethiopische stad staat bekend om haar uit rotsen gehouwen kerken?,Lalibela
Welke Bosnische bedevaartplaats beweert Mariaverschijningen te hebben gehad?,Medjugorje
Welke Semitische taal wordt gesproken in Eritrea en Ethiopië?,Tigrinya
Hoe heet het grootste eiland van Papoea Nieuw-Guinea afgezien van Nieuw-Guinea zelf?, New Britain
Welke zeeën liggen aan weerszijden van New Britain?, Bismarck en Solomon
Hoe heet het voormalige rijk dat delen van Nigeria Benin en Togo beslaat?, Yoruba
Hoe heet het volk dat het koninkrijk Dahomey stichtte?, Fon
Hoe heet de grootste stad van Benin?, Cotonou
Welke zijrivier van de Oranje vormt de noordelijke grens van Lesotho en loopt door de hoofdstad Maseru?, Caledon
Welke hoed is het nationaal symbool van Lesotho en staat in het zwart op de vlag van dat land?, Mokorotlo
Welke konische berg in Lesotho zou de inspiratie vormen voor de hoed die het nationaal symbool is?, Mount Qiloane
