vraag,antwoord
Hoe noemt men een kind dat beide ouders verloren heeft?,Weeskind
Tonica en mediant do en mi
Welke internetwet stelt dat naarmate een discussie langer duurt, de kans op een vergelijking met Hitler toeneemt?,Wet van Godwin
Hoe noemt men voorbereidende werkzaamheden zoals uitgraven en nivelleren op een bouwplaats?,Grondwerk
Welke Japanse filosofie draait rond voortdurende verbetering?,Kaizen
Welke Japanse levensfilosofie verwijst naar een reden van bestaan?,Ikigai
Hoe noemt men het traditionele Arabische vreugdegejuich van vrouwen?,Ululeren of Zaghrouta
Hoe heet een traditioneel reuzenfeest in Noord-Frankrijk en België?,Ducasse
Hoe heet een systeem waarmee schepen uit het water worden getild voor onderhoud?,Sliplift
Welke stof wordt gebruikt om de pomerans van een biljartkeu stroever te maken?,Biljartkrijt
Hoe heet de wollen schouderband die door aartsbisschoppen wordt gedragen?,Pallium
Hoe heet een houten wandelpad door een moerasgebied?,Vlonderpad
Hoe heet het online publiceren van persoonlijke gegevens met kwaadwillige bedoelingen?,Doxxing
Hoe heet het e-mailprogramma van Mozilla?,Thunderbird
Welke Belgische biotechgroep ontwikkelde onder meer efgartigimod?,argenx
Welke Belgische biotechgroep werd opgericht door Onno van de Stolpe?,Galapagos
Welke Chinese fabrikant produceert elektrische auto's zoals de G9?,XPENG
Welke Chinese autofabrikat betekent Build Your Dreams?,BYD
Welk automerk werd opgericht door Henry Leland?,Cadillac
Waarvoor staat de afkorting RSVP op een uitnodiging?,Répondez s'il vous plaît
Welke Duitse speelgoedfabrikant maakt educatieve spellen voor kinderen?,HABA
Welke Franse minister gaf zijn naam aan een bepaalde manier om personen af te beelden?,Étienne de Silhouette
Welke Hongaarse journalist gaf zijn naam aan de balpen?,László Bíró
Welke kleur betekent jaune in het Frans?,Geel
Welke onderwijsvorm in Vlaanderen combineert algemene vorming met beroepsgerichte competenties?,Doorstroomfinaliteit
Wie creëerde de Barbie-pop voor Mattel?,Ruth Handler
Welke Nederlandse winkelketen is gespecialiseerd in meubels en woninginrichting?,Leen Bakker
