vraag,antwoord
Hoe noemen we een beschreven Griekse scherf,ostrakon
Wat is de formule voor butaan, C 4 H 10
Wat is een ander woord voor erffactor,allel
Waar werd het skelet van een hond gevonden die tentoongesteld staat in het museum voor natuurwetenschappen,Goyet
Waar werd het skelet van een mammoet gevonden die tentoongesteld staat in het museum voor natuurwetenschappen,Lier
Hoe heet chinees schrift,hanzi
Hoe heet de mensensoort die naast de homo heidelbergensis leefde in Afrika,Homo Rhodesiensis
Welke wetenschap werd uitgevonden door de Fransman Martel, speleologie
Welke schelpen hadden een monetaire functie, kauri
Hoe heet het hoedachtige deel van een paddenstoel? Het is ook een muts uit griekenland,pileus
Welke Fransman was de geestelijke pionier van flora op de Antillen,Charles Plumier
wat is bijenleer, apidologie
welke wetenschapper toonde dat voortplanting zoekt naar een 1 op 1 verhouding,Fisher
hoe noemen we eenverticale of staande voeg,stootvoeg
welke duitsers vonden het proces uit om ammoniak te maken op grote schaal,Haber en Bosch
Hoe noemen we structurele isomeren in chemische verbindingen, tautomeren
Welke C 6 H 6 verbinding vinden we terug in plastiek en rubber,benzeen
Naar welke duitse elektrochemicus is het verband vernoemd tussen het potentiaalverschil en concentraties van stoffen,Nernst
Welke verbdinging bestaat uit C 2 H 5 OH,ethanol
Hoe noemen we een colloidaal mengsel van a priori niet mengbare stoffen,emulsie
Wat is een andere naam voor kikkererwtenvocht, aquafaba
Welke Brit ontdekte rodium en palladium, Wollaston
wat is de formule voor Soda,Na 2 CO 3
wat is de formule voor chloroform, Cl 3 C OH
In welke politieke constellatie ligt de macht  bij technocraten en een machtig staatsapparaat,corporatisme
Welke vlaamse wetenschapper specialiseert in onderhandelingstechnieken, dirk van poucke
Wat is een synoniem voor sedimentair gesteente,conglomeraat
Welke theorie bepleit de gedragseconomie boven de zogenaamde onzichtbare hand, prospect theory
Hoe heet het belangrijkste werk van Aristoteles,Organon
Welke filosoof kennen we vooral van het begrip falsifieerbaarheid,Popper
Welke Jan was een belangrijke Middeleeuwse mysticus,van Ruusbroec
Welke priester staat bekend als de peetvader van de scholastiek,Petrus Abelardus
Welke Griekse wetenschapper berekende als eerste de fasen van de maan,Meton van Athene
Welke Latijnse term betekent vloeistofoppervlak? We kennen het ook als een lichaamsdeel,meniscus
Welke Italiaanse filosoof bedacht geheugentechnieken? Wij kennen hem vooral omdat hij op de brandstapel stierf,Giordano Bruno
Welk subatomair deeltje komt van het Griekse woord voor sterk,hadron
Welke atmosferische wetenschapper had een beroemde schrijvende broer,bernard vonnegut
Welke Nederlandse wetenschapper en voorzitter van de beroemde solvay-bijeenkomst beschreef in 1911 de elektromagnetische kracht op een lading,Lorentz
Een mijl is gelijk aan acht, furlong
Hoe noemen we eencontactgestuurde elektrische schakel die gebruikt wordt in een alarm,Reed
Welke Nederlandse fysicus doet onderzoek naar de zwaartekracht en heeft het niet zo voor de snaartheorie, Erik Verlinde
Welke Hongaarse Amerikaan geldt als de ontdekker van de nucleaire kettingreactie,Leo Szilard
Naar wie is de wet vernoemd die de spankracht in een veer verhoudt tot de uitwijking,Hooke
Hoe heet de techniek waarbij deuterium en tritium samen helium vormen,kernfusie
Welke bekende uitvinder is minder bekend als bedenker van de fotocopieermachine,Watt
Welke plant was bestanddeel van een bioplastiek die Henry Ford zou bedacht hebben,soja
Welk muziekinstrument is ontwikkeld door Benjamin Franklin? Het raakte in onbruik doordat het publiek massaal last kreeg van nausea,glasharmonica
in welke twee plaatsen werd het Manhattan Project uitgevoerd?,Los Alamos en Oak Ridge
Uit welke mijn kwam het uranium voor het Manhattan project,Shinkolobwemijn
Hoe heette de Belgische voorzitter van Union Minière die het Manhattan Project van uranium voorzag,Edgar Sengier
Welke generaal stond aan het hoofd van het Manhattan Project,Leslie Groves
Welke Hongaarse Amerikaan vond de waterstofbom uit, Edward Teller
Welk principe zorgt er voor dat hitte wordt omgezet in infraroodstraling,stralingskoeling
Welk principe zorgt er voor dat een ster niet implodeert,stralingsdruk
Wat is het tegenovergestelde van een ductiel materiaal,bros
Wie won de eerste nobelprijs geneeskunde? Hij was een assistent van Koch. Hij vond met Paul Ehrlich een vaccin tegen dyfterie,Emil von Behring
Welke oogarts die een telg is uit een bankiersfamilie gaf zijn naam aan een ziekte, Tay Sachs
Welk bedrijf en familie zat achter het oxycontin schandaal,purdue en sackler
Welke Nederlander promoot het medisch nihilisme, Jacob Stegenga
Waar in de hersenen wordt informatie van het korte naar langetermijngeheugen gebracht,hippocampus
Welke voorloper van Novartis bracht LSD op de markt,Sandoz
Wat is een algemene naam voor seksuele afwijking, parafilie
Welke atomaire stof vervolledigt de formule voor Isobetadine? povydon,iodium
Wat is de formule voor lachgas, N2O
Welke ziekte krijg je niet bij een bepaalde mutatie van het gen CCR5-delta32,HIV
Welke Duitser is de vader van het klonen,Speman
Wat is de naam voor de laterale fissuur in hersenen,groeve van Sylvius
Hoe heette een aandoening in de Middeleeuwen die aanleiding geeft tot motorische onrust,frenesis
Waar wordt het vrouwelijk DNA geregenereerd,mitochondriën
Waarvoor diende fentanyl voor het een vreselijke drug werd,anesthesie bij paarden
Hoe heet leven na dood waarbij iemand ingevroren wordt om later weer te ontdooien,cryonisme
Welke Grieksromein uit Pergamon zou 15 eeuwen de geneeskunde bepalen, Claudius Galenus
Wie was de eerste vrouwelijke arts in België?, Isala Van Diest
Van welke Griekse wetenschapper is enkel een botanisch boekje overgebleven, Theophrastus
Welke Poolse onderzoeker deed belangrijke bijdragen aan de fauna en flora van de grote oceaan, Kubary
16de eeuwse Zwitserse dokter, Gessner
Grondlegger van de erfelijkheidsleer, Mendel
Bedenkers van het dubbele helixmodel, Crick en Watson
Wiens experimenten voorzagen Crick en Watson van hun bewijsmateriaal, Franklin
Andere naam voor pijnstillers, analgetica
Veelgebruikt middel tegen parasieten, closantel
Ander woord voor uierontsteking, metritis
Studie van tekens, semiotiek
dokter die hygiëne introduceerde, Lister
Hoe heet het syndroom waarbij men losse gewrichten krijgt, Ehlers Danlos
Welke Zweedse geneticus kreeg de Nobelprijs voor zijn werk aan oud DNA?, Paabo
Welke evolutietheorie stelt dat verworven eigenschappen erfelijk zijn?, Lamarckisme
Hoe heten de uiteinden van chromosomen die een rol spelen in veroudering?, Telomeer
Hoe heet de genetische aandoening waarbij een man een extra X-chromosoom heeft?, Syndroom van Klinefelter
Test voor het opsporen van Down Edwards syndroom en Patau syndroom door het DNA van de baby afkomstig van de placenta in het bloed van de moeder te meten, NIPT
Hoe noemen we een getal dat gelijk is aan de som van zijn delers, Perfect getal 
Wat is de wetenschappelijke naam voor geslachtsloze voortplanting, Parthenogenese
Hoe heten de blaasjes in de eierstokken waar eicellen geboren worden, follikels
Welke Belg heeft de passe-vite uitgevonden, Simon
Deze Duitse autodidacte vond de Schieberinne uit die vandaag nog gebruikt wordt voor onderzoek naar oppervlaktespanning, Agnes Pockels
Wie stichtte de Londense beurs, Thomas Gresham
Hoe heet de test die vergif opspoort bij forensisch onderzoek en veel arsenicum-moorden ophelderde, Marsh
Hoe heet de studie van mossen, Bryologie
Welke wetenschapper vond de Lambda calculus uit, Alonzo Church
Hoe noemt de geneeskunde van het rund?,Buatrie 
Hoe heet het laagste punt aan de hemelbaan?,Nadir
Welke ziekte veroorzaakt kromming van de penis door bindweefselvorming?,Peyronie
Hoe heet de oude theorie die vuur verklaarde als een stof in materialen?,Flogiston
Hoe heet het hoogste punt op de baan van een hemellichaam?,Apogeum
Hoe heet de nieuwe dino-soort waarvan eerst gedacht werd dat het een onvolgroeide T-Rex was?, nannotyrannosaurus
Welk bot in het lichaam van dieren blijkt goed geschikt om te bepalen of het volgroeid is en wordt gebruikt in de paleontologie?, tongbeentje
Welke Nederlandse Joods-Marokkaanse opiniemaker en schrijver stelde een piramide voor als alternatief voor die van Maslow, David Pinto
Hoe heet de oudste nog bewaarde locomotief die in het museum van de NMBS staat, Land van Waas
Wellicht de grootste wiskundige van de twintigste eeuw voornamelijk in categorietheorie die stierf in eenzaamheid in de Pyreneeên, Alexander Grothendieck
Hoe heet de schaal voor technologische vooruitgang, Kardashev
Hoe heet de schaal voor uitwerpselen, Bristol
Hoe heet de schaal voor wenen van ajuinen, Pyruvate
Hoe heet de schaal voor seksuele geaardheid, Kinsey
Hoe heet de schaal voor vervuiling in water, Platina Kobalt
Naar welke twee Italiaanse steden zijn schalen vernoemd voor impact van een meteoorinslag, Palermo en Torino
Hoe heet de schaal voor lichtvervuiling, Bortle
Hoe heet de schaal voor de impact van een steracteur op het succes van de film, Ulmer
Hoe heet de schaal voor mannelijke kaalheid, Hamilton Norwood
Welke twee wetenschappers ontwikkelden naast Binet de IQ-test, Goddard en Weschler
Hoe heet de schaal voor tornado's, fujita
Hoe heet de schaal voor schade door aardbevingen, Mercalli
Hoe heet de schaal voor tropische cyclonen en orkanen, saffir-simpson
Hoe heet de schaal voor blootstelling aan radioactiviteit, Röntger-Sievert
Welke schaal meet de graad van psychotpatie, Hare
Welke schaal meet de graad van comateuze toestand, Glasgow
Welk instrument tekent een ellips met twee bewegende delen, Trammel van Archimedes
Welk politiek venster bakent af wat maatschappelijk aanvaardbaar is op een bepaald moment, Overton
Theorie dat kinderen agressief gedrag kopiêren van volwassenen genoemd naar een popje dat niet omvalt, Bobo
Welke schaal berekent de mate waarin ouderen nog in staat zijn om dagelijkse activiteiten te vervullen, Katz
Hoe heet een bolcirkel die de straal van de bol heeft, grote cirkel of ortozoom
Hoe heten de horizontale en verticale afstanden bij traptreden, aantrede en optrede
Andere naam voor scheurbuik, Beri Beri
Welke stof heeft chemische samenstelling C4H8O2, boterzuur
Welke stof heeft chemische samenstelling  C6H8O7, Citroenzuur
Schokkende beweging bij het over elkaar schuiven van twee voorwerpen, stick-slip
Nederlands filosoof en wiskundige die bijdroeg aan de verbreiding van Newtons ideeën, 's Gravesande
Mengsel van twee spiegelbeeldige chemische vormen van een stof, racemisch
Australopythecus die in 1994 gevonden werd in Zuid-Afrika, Little Foot
Franse astronoom uit de 18de eeuw die een catalogus opstelde van nevelachtige objecten, Messier
Uit welke buigzame houtsoort werden in de Middeleeuwen bogen vervaardigd, taxus
Het uit de taxus gewonnen paclitaxel wordt gebruikt in chemotherapie en is dus een, cytostaticum
Wie begreep dat mosterdgas kon gebruikt worden tegen leukemie, Stewart Alexander
Hoe heet de berg in Chili waar tal van sterrenwachten staan, La Sillia
Hoe heet de spin-off van het MIT die gespecialiseerd is in robotica, Boston Dynamics
Wie was commandant van Apollo 12 en de derde mens op de maan, Pete Conrad
Belgische econoom en professor aan de VUB van Joodse afkomst en populaire trotskist, Ernest Mandel
Amerikaanse uroloog die zijn naam gaf aan een operatie waarbij een scheve penis wordt rechtgezet, Nesbit
Japanse filosoof die een sleutelrol speelde bij de verspreiding van het Zen-boeddhisme in het Westen, Suzuki
Hoe heet de natuurwet die de relatie beschrijft tussen de temperatuur en het getjirp van krekels, Dolbear
Hoe heet een slaapstoornis waarbij mensen seksuele handelingen stellen?,Sekssomnia
Hoe heet onderkoeling door plots koud water?,Hydrocutie
Welke bioloog staat bekend om zijn theorie over bevolkingsgroei?,Paul Ehrlich
Welke testprocedure meet het brandstofverbruik van auto’s?,WLTP
Wie ontdekte insuline?,Frederick Banting
Welke harde houtsoort werd gebruikt voor scheepslagers?,Pokhout
Hoe noemden de Grieken barnsteen?,Elektrum
Welk metereologisch fenomeen zorgt voor de stortvloeden in Spanje, Depresión Aislada en Niveles Altos of DANA
Hoe heet de cilindrische prikkeldraad die op muren van gevangenissen ligt?, Concertinadraad 
Welke Franse chirurg ontwikkelde een nieuwe techniek om bloedvaten te hechten en kreeg daarvoor de nobelprijs in 1912, Alexis Carrel
Hoe heet de tweede grootste maan van neptunus?, Proteus
Hoeveel botten heeft een mens?, 206
Welk experiment bepaalde de lading van een elektron aan de hand van een zwevende oliedruppel?, Proef van Millikan
Welk door Delftse studenten opgericht bedrijf ontwikkelde een vacuümtrein?, Hardt Hyperloop
Welke Franse fysicus en militair ingenieur wordt beschouwd als de vader van de thermodynamica?, Nicolas Carnot
Welke Franse kunstenaar en uitvinder patenteerde verpulverd grafiet met klei als vulling voor potloden?, Nicolas Conté
Wie schreef Principles of Biology en introduceerde de uitdrukking Survival of the fittest, Herbert Spencer
Hoe noemen we de enorme toename aan complexe levensorganismen op aarde zo'n 540 miljoen jaar geleden, Cambrische explosie
Welke ziekte probeerde men op te sporen met de Wassermantest, Syfilis
Welke planeet heeft de hoogste gemiddelde oppervlaktetemperatuur?, Venus
Welk metaal geleidt het best bij kamertemperatuur?, Zilver
Welk enzym is verantwoordelijk voor het ontwikkelen van de DNA-Helix tijdens replicatie?, Helicase
Welk element werd ontdekt door C.F. Scheele nadat hij zoutzuur liet reageren met bruinsteen?, Chloor
Welk effect beschrijft dat een groep individuen minder productief wordt naarmate de groep groter wordt, Ringelman
Welke worm parasiteert op de mens en veroorzaakt dracunculiasis, Guineaworm
Wat bedacht de gynaecoloog pfannenstiel, bikinisnede
Wiskundige die de wet formuleerde dat meer concurrentie leidt tot minder onderscheid, Hotelling
Van welke legering worden propellers gemaakt, Monel
Hoe noemen we afgebakende gebieden waarvan de bevolking een specifieke levensstijl en leefomgeving deelt en waar de mensen hoge leeftijden bereiken, Blauwe Zones
Welke Ierse statisticus publiceerde onder het pseudoniem Student over de t-distributie en werd later hoofdbrouwer bij Guiness, Gosset
Welke structuur bestaat uit een supermassief zwart gat en een hete accretieschijf die krachtige relativistische jets produceren, Quasar
Welke geologische structuur ontstaat wanneer twee tectonische platen onder elkaar schuiven, subductiezone
Welke theorie zegt dat een soort voortdurend moet evolueren om zijn ecologische niche te behouden, Red Queen
Welke informatietheorie gebruikt evolutionaire principes, genetisch algoritme
Verlangen naar geborgenheid als een kat in een kartonnen doos, Thigmofilie
Infrasoon geluid dat mensen de controle over hun darmen doet verliezen, Brown note
Amerikaans chirurg en de vader van de spijsvertering, William Beaumont
Duits scheikundige die de Nobelprijs Chemie in 1931 won voor een procedé om brandstof te maken uit bruinkool, Bergius
Ringvormige zeestroming parallel aan de isobaren en haaks op de drukgradiënt, Gyre
Hoe wordt cellulitis in de volksmond vaak genoemd?,Appelsienhuid
Hoe heet de wetenschap die zich bezighoudt met schimmels?,Mycologie
Welke Belgische fysicus werkte samen met Higgs en Englert?,Robert Brout
Welke Amerikaan bedacht frequentiemodulatie, Armstrong
Welke Schotse geoloog wordt “vader van de moderne geologie” genoemd?,Charles Lyell
Welke medische techniek brandt weefsel weg?,Cauterisatie
Welke prehistorische zeehagedis leefde in het Jura?,Ichthyosaurus
